"Envejecimiento en Red, Centro de Ciencias Humanas y Sociales, CSIC. Contacto: enred@cchs.csic.es. Más información: http://envejecimiento.csic.es/documentos/documentos/enred-estadisticasresidencias2019.pdf ",,,,,,,,,,,,
"Residencias en Santa Cruz de Tenerife, 2019",,,,,,,,,,,,
,,,,,,,,,,,,
Denominación,Dirección,,,C. Postal,Municipio,Teléfono,Titularidad,Plazas,URL,Latitud,Longitud,Última actualización:
Residencia Santa Catalina,Calle,Lisboa,23 - Urb. Paraíso Fañabé,38670,Adeje,922 72 48 58,Privada,5,,"28,090336","-16,724895",20/07/2017
Residencia de personas mayores José Almeida González,Avenida,Rosa de los Vientos,16,38670,Adeje,922 77 57 83,Pública local,18,,"28,118136","-16,733044",04/04/2017
Residencia sociosanitaria María Auxiliadora,Calle,Rafael Clavijo García,19,38550,Arafo,922 51 16 98,Pública local,34,,"28,341591","-16,417954",13/07/2017
Residencia de mayores Los Cristianos,Avenida,Juan Carlos I,22,38650,Arona,922 78 80 67,Pública local,25,www.arona.org/Guia-Empresarial/ctl/Ver/mid/439?id=681,"28,052279","-16,713368",12/04/2019
Centro Residencial Nina Jaubert,Camino,El Brezal,s/n,38710,Breña Alta,922 43 54 14,Pública local,26,,"28,644989","-17,787815",17/07/2017
Casa de mayores de Buenavista del Norte,Calle,El Horno,4,38480,Buenavista del Norte,922 12 90 03,Pública local,20,casamayoresbuenavist.wixsite.com/casa-mayores-bta,"28,374385","-16,851770",06/05/2019
Centro de acogida Virgen de Candelaria,Calle,Francisco Garabote García,3,38520,Candelaria,922 50 18 83,Privada,94,www.geron.es/residencia/residencia-mayores-virgen-de-candelaria-tenerife,"28,381911","-16,365369",05/04/2019
Centro sociosanitario Fasnia,Calle,Emiliano Díaz Castro,s/n,38570,Fasnia,922 53 03 54,Pública local,75,,"28,235588","-16,439505",01/08/2017
Centro de acogida Las Indias,Carretera,General,61,38740,Fuencaliente de la Palma,663 89 80 12,Pública local,17,,,,08/04/2019
Centro Geriátrico Nuestra Señora de la Concepción,Plaza,de Santo Domingo,1,38450,Garachico,922 13 33 15,Pública local,68,,"28,373756","-16,759356",04/04/2019
Centro asistencial de mayores Sor Josefa Argote,Calle,Machines,15,38787,Garafía,922 40 04 58,Pública local,20,,"28,828081","-17,859346",26/05/2015
Hogar Rodolfo Delgado Campos,Calle,Ángel Arocha,42 - 44,38595,Granadilla de Abona,922 75 99 00,Pública local,12,,"28,131325","-16,529285",04/04/2017
Asociación Centro Evangélico de Ancianos Cedar,Calle,Saltadero,28,38611,Granadilla de Abona,922 39 15 94,Privada,35,,"28,120181","-16,576908",24/04/2019
Residencia geriátrica Santo Domingo,Avenida,8 de agosto,s/n,38440,Guancha (La),922 36 10 06,Privada,60,www.residenciasantodomingo.com,"28,389700","-16,673730",13/09/2013
Centro Sociosanitario Gerovitae La Guancha,Calle,Solítica,s/n,38440,Guancha (La),922 82 98 36,Pública local,75,www.gerovitaelaguancha.com,"28,374435","-16,652562",11/04/2019
Piso tutelado de la 3ª edad,Calle,Seguidillas,26 - Urb. El Pinillo,38680,Guía de Isora,922 85 01 00,Pública local,2,,"28,208851","-16,774529",27/05/2015
Centro sociosanitario Güímar,Calle,Hernán Cortés,6,38508,Güímar,922 52 82 32,Privada,75,www.aeromedica.com/servicios-sociales/centros-geriatricos/tenerife/centro-socio-sanitario-guimar/el-centro.html,"28,295165","-16,377653",20/07/2017
Residencia de personas mayores de Hermigua,Calle,El Curato,s/n,38820,Hermigua,922 88 08 41,Pública local,18,,"28,166049","-17,196997",17/07/2013
Casa de acogida Jesús de Nazaret,Camino,El Cardonal,s/n - Pol. Ind. Las Almenas,38430,Icod de los Vinos,922 81 65 89,Privada,36,www.madredelredentor.com/jesus-de-nazaret/,"28,381994","-16,697639",08/04/2019
Centro Sociosaniario del Norte,Calle,Las Gaviotas,22,38434,Icod de los Vinos,922 81 48 38,Pública local,100,www.aeromedica.com/servicios-sociales/centros-geriatricos/tenerife/centro-socio-sanitario-del-norte-de-tenerife/162.html,"28,384006","-16,684644",09/01/2015
Centro Sociosanitario Casa de los mayores,Calle,Real,232,38370,Matanza de Acentejo (La),922 57 90 50,Pública local,32,,"28,447334","-16,455312",09/04/2019
Residencia Geriátrica San Sebastián,Plaza,San Sebastián,1,38300,Orotava (La),922 32 58 36,Pública local,40,,"28,393862","-16,521672",07/07/2017
Privilegium San Fernando,Calle,Alemania,11 - Urb. San Fernando,38400,Puerto de la Cruz,922 37 61 13,Privada,23,www.privilegium.es,"38,407190","-16,544010",17/07/2017
Centro residencial Davida,Calle,Brezo,19 - Urb. La Paz,38400,Puerto de la Cruz,922 38 99 55,Privada,62,www.residenciadavida.com,"28,469809","-16,254853",08/07/2017
Hospital de la Inmaculada Concepción,Calle,Cologán,19,38400,Puerto de la Cruz,922 38 38 31 / 922 38 19 58 / 645 09 97 64,Privada,67,fundacionhospitaldelainmaculada.org,"28,416016","-16,533915",17/04/2019
Fundación Hogar Santa Rita II,Carretera,General Las Dehesas,128,38400,Puerto de la Cruz,922 38 95 32,Privada,522,www.fundacionhogarsantarita.org,"28,402900","-16,564700",07/05/2018
Casa Posada Hermano Pedro - HH. Franciscanos de Cruz Blanca,Calle,Iriarte,8,38400,Puerto de la Cruz,922 38 16 08,Privada,24,www.fundacioncruzblanca.org/fundacion-cruzblanca/voluntariado-casa-familiar-puerto-cruz.php,"28,413395","-16,545153",13/04/2019
Miniresidencia Las Adelfas,Calle,Tigalete,2 - Urb. Las Adelfas,38400,Puerto de la Cruz,922 29 41 80 / 922 37 46 83,Privada,26,,"28,405514","-16,564813",06/05/2019
Residencia de tercera edad de Puntagorda,Camino,del Pinar,9 - A,38789,Puntagorda,922 48 78 08,Pública local,28,,"28,770506","-17,978698",15/05/2015
Residencia de Mayores Puntallana,Calle,Cruz Herrera,16,38715,Puntallana,922 43 06 23,Pública local,29,,"28,752365","-17,753370",04/04/2019
Centro Sociosanitario Nuestra Señora del Carmen,Calle,Piloto,82,38410,Realejos (Los),922 35 56 08,Pública local,60,geriatricoscanarias.com,"28,385894","-16,582487",08/04/2019
Hogar de Ancianos San Andrés y Sauces,Carretera,Comarcal 830,margen izquierdo,38720,San Andrés y Sauces,922 45 12 77,Pública local,16,sanandresysauces.es/servicios-sociales/residencia-de-mayores-hogar-de-ancianos,"28,806467","-17,774368",10/07/2017
Hospital Nuestra Señora de Los Dolores,Urbanización,El Gramal,s/n,38108,San Cristóbal de La Laguna,922 23 91 00,Pública local,99,www.iass.es/centros/2127-hospital-nuestra-sra-de-los-dolores,"28,449076","-16,308912",25/07/2017
Hogar Virgen Poderosa,Calle,Nava y Grimón,28,38201,San Cristóbal de La Laguna,922 63 22 27,Privada sin fin de lucro,29,,"28,489652","-16,313190",07/07/2017
Hogar Santísimo Cristo de La Laguna,Calle,Viana,64,38201,San Cristóbal de La Laguna,922 25 22 47,Privada sin fin de lucro,115,,"28,491954","-16,313118",10/07/2017
AMAVIR Tejina,Camino,Palenzuela,37,38260,San Cristóbal de La Laguna,922 54 67 50,Pública local,76,www.amavir.es/residencia-de-ancianos-tenerife-amavir-tejina-santa-cruz,"28,533596","-16,370415",15/04/2019
El Jardín del Abuelo,Calle,Finca del Cura,3,38291,San Cristóbal de La Laguna,922 25 00 50,Privada,16,,"28,468164","-16,324353",26/04/2018
Centro Sociosanitario San Juan de la Rambla,Calle,El Rosario,s/n,38420,San Juan de la Rambla,922 36 00 15 / 922 35 05 71,Pública local,36,www.residenciasanjuandelarambla.com,"28,395113","-16,628445",07/09/2017
Residencia de 3ª edad Inmaculada,Calle,Profesor Armas Fernández,4,38800,San Sebastián de la Gomera,922 14 51 71,Pública local,30,,"28,091738","-17,112672",30/07/2017
Residencia de ancianos Santa Cruz de la Palma,Camino,de la Dehesa,Km. 2,38700,Santa Cruz de la Palma,922 41 84 15 / 922 41 81 26,Pública local,200,,"28,696600","-17,769900",04/04/2019
Hospital geriátrico Nuestra Señora de los Dolores,Calle,San Vicente de Paúl,1,38700,Santa Cruz de la Palma,922 42 32 04,Pública local,150,,"28,686195","-17,763224",04/04/2019
AMAVIR Santa Cruz,Calle,América Gonzales,s/n - Urb. Ifara,38004,Santa Cruz de Tenerife,922 28 48 43,Privada,178,www.amavir.es/residencia-de-ancianos-santa-cruz-de-tenerife-amavir-santa-cruz,"28,479177","-16,255980",07/07/2017
Residencia de 3ª edad Virgen de Begoña III,Calle,Costa y Grijalba,30,38004,Santa Cruz de Tenerife,922 10 04 97,Privada,24,,"28,470184","-16,258715",09/07/2017
Centro sociosanitario Santa Cruz,Calle,Galcerán,10,38004,Santa Cruz de Tenerife,922 24 56 57,Pública local,158,www.aeromedica.com,"28,464111","-16,282725",05/04/2019
Centro residencial Mirador de Ifara,Calle,Mercedes Machado,1,38004,Santa Cruz de Tenerife,922 01 24 00,Privada,184,www.miradordeifara.com,"28,479245","-16,257225",05/04/2019
Residencia de tercera edad Virgen de Begoña I,Rambla,Santa Cruz,93,38004,Santa Cruz de Tenerife,922 27 78 38,Privada,40,,"28,473469","-16,254658",04/04/2017
Hospital Febles Campos,Calle,Domingo J. Manrique,2,38006,Santa Cruz de Tenerife,922 84 33 00,Pública local,267,www.iass.es/iass/DEFAULT/detalles-centro.jsp?DS128.step=3&DS128.PROID=157641&refPage=centros-mayores-atencion-residencial.jsp&refObj=326785,"28,469261","-16,267816",28/08/2013
Hogar Nuestra Señora de la Candelaria,Calle,Poeta Ramón Gil Roldán,3,38006,Santa Cruz de Tenerife,922 27 04 10,Privada sin fin de lucro,97,,"28,468539","-16,267232",31/10/2012
Residencia de tercera edad Virgen de Begoña II,Calle,Juan de Miranda,10,38007,Santa Cruz de Tenerife,922 20 05 48,Privada,36,,"28,465550","-16,265141",04/04/2017
Residencia Concha Castro,Calle,Adeje,35- Bº de la Salud Alto,38008,Santa Cruz de Tenerife,922 21 24 00,Privada sin fin de lucro,78,residenciaconchacastro.com,"28,473790","-16,277807",08/04/2019
ISABA Casa de Mayores,Calle,Andrés Orozco Batista,20 - Vistabella,38009,Santa Cruz de Tenerife,922 65 79 45 / 922 65 70 98,Privada,26,casamayores.com,"28,465389","-16,281242",04/04/2019
Hogar de Mayores Virgen de Candelaria,Carretera,de Santa Cruz a La Laguna,74 - Vistabella,38009,Santa Cruz de Tenerife,922 64 39 39 / 659 37 08 02,Privada,24,residenciacandelaria.wordpress.com/introduccion/,"28,464114","-16,282738",08/04/2019
Residencia de la 3ª Edad San Pancracio Vistabella,Carretera,General de Santa Cruz a La Laguna,61,38009,Santa Cruz de Tenerife,922 66 24 24,Privada,28,www.residenciavistabella.com,"28,463541","-16,282802",12/07/2017
Hogar de mayores Santa María de la Ascensión,Calle,San Felipe,5 - Urb. Tristán,38009,Santa Cruz de Tenerife,922 21 91 81,Privada,19,hogardemayorestenerife.com,"28,458509","-16,277832",31/10/2012
Centro de mayores Toki Eder,Carretera,Santa Cruz a La Laguna,48 - El Ramonal,38009,Santa Cruz de Tenerife,922 64 38 56,Privada,22,centromayorestokieder.com,"28,461302","-16,282121",08/04/2019
Residencia de mayores de Ofra,Calle,Santa María Soledad,12,38010,Santa Cruz de Tenerife,922 64 63 99 / 922 64 62 51 / 922 65 50 00,Pública local,172,www.iass.es/iass/DEFAULT/detalles-centro.jsp?DS128.step=3&DS128.PROID=157649&refPage=centros-mayores-atencion-residencial.jsp&refObj=326785,"28,456791","-16,288928",11/04/2019
Centro sociosanitario Acorán,Calle,Mayantigo,4,38111,Santa Cruz de Tenerife,922 68 81 80,Privada,39,www.acoran-tenerife.com,"28,417368","-16,303279",17/07/2019
Centro sociosanitario Santa Úrsula,Carretera,Nueva de Corujera,104,38390,Santa Úrsula,922 30 48 98,Pública local,60,geriatricoscanarias.com/centros/centro-sociosanitario-santa-ursula/,"28,412799","-16,500149",04/04/2019
Hogar Santa Gema,Calle,Catalina Lorenzo Cáceres,11,38436,Santiago del Teide,922 86 36 64,Pública local,24,www.residenciahogarsantagema.blogspot.com,"28,293186","-16,814566",09/04/2019
Casa de acogida Madre del Redentor,Calle,Padre Julián de Armas,9 - 14,38360,Sauzal (El),922 57 03 00,Privada,112,www.madredelredentor.com/madre-del-redentor/,"28,477572","-16,434849",08/04/2019
Residencia geriátrica Nuestra Señora de la Luz,,Placeta de la Constitución,6,38470,Silos (Los),922 84 00 51,Pública local,32,,"28,365552","-16,814853",09/04/2019
Casa de acogida Familia Quesada Sánchez,Calle,El Patronato,3,38350,Tacoronte,922 97 17 16,Privada,86,www.geron.es/residencia/residencia-de-mayores-tacoronte-tenerife,"28,478185","-16,411818",10/07/2017
Residencia de 3ª edad Tazacorte,Carretera,del Puerto,2,38770,Tazacorte,922 48 10 01 / 636 12 02 69,Pública local,14,,"28,644358","-17,933758",16/08/2017
Residencia Jardines de San Marcos,Carretera,de Toscas Portezuelo,88,38292,Tegueste,922 15 02 96 / 922 54 46 02,Privada,46,www.residenciasanmarcos.com,"28,520806","-16,353641",15/04/2019
Vivienda tutelada Nuestra Señora de los Reyes,Calle,La Alameda,4,38870,Valle Gran Rey,922 80 53 93,Pública local,17,,"28,094907","-17,335643",07/08/2013
Centro Sociosanitario Echedo,,Echedo,s/n,38900,Valverde,922 55 17 81,Pública local,52,www.elhierro.es/rsidencias,"27,831846","-17,922870",06/05/2019
